{
    "$schema": "http://json-schema.org/draft-07/schema#",
    "title": "Testcase Schema",
    "type": "object",
    "properties": {
      "type": {
        "type": "string",
        "enum": ["Testcase"]
      },
      "name": {
        "type": "string"
      },
      "tc_no": {
        "type": "string"
      },
      "version": {
        "type": "object",
        "properties": {
          "description": {
            "type": "string"
          },
          "default": {
            "type": "string"
          }
        },
        "required": ["default"]
      },
      "arg": {
        "type": "object"
      },
      "dut": {
        "type": "array",
        "items": {
          "type": "string"
        }
      },
      "dut_cfg": {
        "type": "array",
        "items": {
          "type": "string"
        }
      },
      "port": {
        "type": "array",
        "items": {
          "type": "string"
        }
      }
    },
    "required": ["type", "name", "tc_no", "version", "arg", "dut", "dut_cfg", "port"]
  }