{
 "type": "Testcase",
 "name": "Port Throughput",
 "tc_no": "tc_6_4_3",
 "version": {
  "description": "Version number, use development or modification date",
  "default": "v20240902"
 },
 "arg": {
  "interface": {
   "description": "Interface MAC address setting",
   "default": {
    "up": {
     "description": "Uplink interface MAC address setting",
     "default": "00:01:01:02:02:02"
    },
    "down": {
     "description": "Downlink interface MAC address setting",
     "default": "00:01:02:02:02:02"
    }
   }
  },
  "frame_size": {
   "description": "Test frame size",
   "default": [64, 65, 256, 1024, 1518, 9000]
  },
  "duration": {
   "description": "Test duration for each frame size",
   "default": 60
  },
  "search": {
   "description": "Binary search test setting",
   "default": {
    "init": {
     "description": "Initial load",
     "default": 100
    },
    "lower": {
     "description": "Minimum load",
     "default": 100
    },
    "upper": {
     "description": "Maximum load",
     "default": 100
    }
   }
  }
 },
 "dut": ["DeviceA"],
 "dut_cfg": ["DeviceA_Setup", "DeviceA_Teardown"],
 "port": ["PortDeviceA_1", "PortDeviceA_2"]
}