{
 "type":"Testcase",
 "name":"路由信息协议（RIP",
 "tc_no":"tc_6_7_5",
 "version": {
  "description": "版本号，使用开发或修改日期",
  "default": "v20240917"
 },
 "arg":{
  "interface": {
   "description": "仪表接口Mac地址设置",
   "default": {
     "mac_up_address": {
      "description": "上行接口Mac地址设置",
      "default": "00:01:01:02:02:02"
     },
     "mac_down_address":{
      "description": "下行接口Mac地址设置",
      "default": "00:01:02:02:02:02"
     },
     "ipv4_up_address":{
      "description": "上行接口IPv4地址设置",
      "default": "192.168.1.100"
     },
     "ipv4_up_gateway":{
      "description": "上行接口IPv4网关设置",
      "default": "192.168.1.1"
     },
     "ipv4_down_address":{
      "description": "下行接口IPv4地址设置",
      "default": "192.168.2.100"
     },
     "ipv4_down_gateway":{
      "description": "下行接口IPv4网关设置",
      "default": "192.168.2.1"
     }
   }
  }
 },
 "dut":["DeviceA"],
 "dut_cfg":["DeviceA_Setup","DeviceA_Teardown"],
 "port":["PortDeviceA_1","PortDeviceA_2"]
}