{
 "type":"Testcase",
 "name":"生成树协议",
 "tc_no":"tc_6_5_9",
 "version": {
  "description": "版本号，使用开发或修改日期",
  "default": "v20240917"
 },
 "arg":{
  "interface": {
   "description": "仪表接口Mac地址设置",
   "default": {
     "up": {
      "description": "上行接口Mac地址设置",
      "default": "00:01:01:02:02:02"
     },
     "down":{
      "description": "下行接口Mac地址设置",
      "default": "00:01:02:02:02:02"
     }
   }
  }
 },
 "dut":["DeviceA","DeviceB","DeviceC","DeviceD"],
 "dut_cfg":["DeviceA_Setup","DeviceA_Teardown","DeviceB_Setup","DeviceB_Teardown","DeviceC_Setup","DeviceC_Teardown","DeviceD_Setup","DeviceD_Teardown"],
 "port":["PortDeviceA_1","PortDeviceA_2"]
}